ID|Role|YearsExperience|Gender|Age|Strengths|Weaknesses|Opportunities|Threats
524|Master Gardener Volunteer|0-5|Female|Prefer not to respond|Provides level classes yearly and opportunities to obtain continuing education. |Would eliminate the online classes and conduct conventional classes where MGVs can collaborate and interact. |MGVs just want to garden. No big changes that I would like to see occur. Online recording hours is a good idea. |Local Garden Clubs seem to be more inviting. Members just want to enjoy gardening, they don’t have to go through training and changes. No recorded hours and al the levels that MGVs need to accomplish. Some local gardeners are just as knowledgeable as MGVs. 
525|Master Gardener Volunteer|0-5|Female|65+|Training, volunteer & education opportunities.|Increased communication re specific gardens.  Some gardens have longstanding MGVs and don't feel very welcoming to new MGVs.|Increased presence at community events.|Funding.
526|Master Gardener Volunteer|0-5|Female|45-64|Community outreach and providing accurate information to local residents to help them solve garden problems|There seem to be a small group of people who make most of the decisions and they are not especially welcoming to new members.|Perhaps partnering with schools to develop curricula about the value of plants to communities, wildlife and the environment.  We also need to work to raise awareness of our organization and the resources we provide at no cost.|Funding is a major issue.  Our competitors are other government and university programs, who compete for limited funds.  We need to find ways other than the plant sale to raise money.
527|Master Gardener Volunteer|43595|Female|45-64|Helps others, educational opportunities |Local club setting mandatory events/participation. Encouraged participation is much more acceptable and younger people have commitments with children, work, etc.|Endless really. We are lacking in water gardening and koi keeping info.|Not geared toward 20-40 yr olds and their families
528|Master Gardener Volunteer|10+|Female|65+|It offers multiple opportunities for initial training. It offers multiple opportunities for retraining, online articles  or adding to MG's knowledge.  It offers frequent  opportunity to communicate with MG Educator.  It is easy to sign up for volunteer experiences.  |Needs a better/faster/more efficient way of reporting hours spent volunteering, continued education, etc. And then faster response in sending annual membership card|One can frequently volunteer for a variety opportunities.One doesn't get stuck in one location.|Don't know
529|Master Gardener Volunteer|10+|Male|45-64|Helping the public with  their hortical issues.|Disconect between the volunteers and staff.|Better communication with the volenteers|Some of the personal decisions make no sence to the volenteers. Make some wonder if mgv program will be dissloved
530|Master Gardener Volunteer|10+|Female|65+|Education and opportunities for volunterring|Support from us and too much reliance on online learning|Not sure|Elimination of county support and presence
531|Master Gardener Volunteer|0-5|Female|45-64|the opportinity to learn and contribute |too new of a member to make suggestions|support the enviroment on earth day with a theme cleaning up & garbage pick up |the guidelines not clear, for tne newest members
532|Master Gardener Volunteer|0-5|Female|45-64|The local officers really keep the program together. We don’t really have anyone at the county level in Polk County. |I would like a searchable base of reference information .|Possibly working with Agriculture classes I schools to bring younger interest. It seems everyone in our group is well over 50. |It is hard for people in remote areas to take a training class 
533|Master Gardener Volunteer|0-5|Female|45-64|Knowledge available. Connections with people with passion for gardening |When completing level 2 classes online it has me put in my email but I am not sure I get credit for completion. |Staff available for lectures is a definite plus. |Inability of extension staff to provide level 1 programs more often due to their other duties
534|Master Gardener Volunteer|0-5|Female|25-44|Great speakers and resources|A lot of emails-it's a little overwhelming specially when multiple people are emailing about the same program or volunteer project; most of the classes or speakers are during the day (I work full time and can't make a lot of things)|Getting more active with kids and plants|None
535|Master Gardener Volunteer|0-5|Female|65+|Strength - training and providing information; tend gardens in the community, interact with the community.  What excites - the training, connection with people, environmental improvements|More diversity, more promotion of environmental care, home gardening, |opportunities to partner with like-minded groups and organizations; I'm not sure how the program measures outcomes but that might be an opportunity to look at community impact other than counting |Is there enough support from UW?  Enough staffing?  Promotion?  If the quality isn't maintained these are threats
536|Master Gardener Volunteer|0-5|Female|65+|I just finished the survey and wanted to add a comment.  I don't know enough to answer these questions at length.  It would be good to have a focus group for discussion so they can be explored in more depth ... and maybe you are planning that.  thanks|xx|xx|xx
537|Master Gardener Volunteer|10+|Male|65+|geting to help non MG's learn about plants and gardens.|The uncertent of the last 5 years.|Native Plants and using them in design.|Only within the program. MGs are volunteers  and not employees, other interests compete for our time.
538|Master Gardener Volunteer|0-5|Female|65+|Providing useful information, touch all bases of plant life, diseases etc.|I would like to see more classes offered during the week and on weekends.|Be more involved with local groups that are encouraging planting native plants and saving  certain species|I think is was much easier handing in our hours to local agency. ( I've not gone on line yet!)
539|Master Gardener Volunteer|0-5|Female|45-64|I love the classes and the people I have met.  So many good topics I have learned about.  There are so many opportunities to learn more!  I like how we can all learn from each other in the group.|I know there needs to be accountability, but as long as people are helping, do we really need to keep track of hours??  Is there a better way to keep track of things?|I see so many future opportunities for Master Gardeners!!  There are so many people realizing that gardens are not hard to do and growing your own food is so much better for you.  I feel like there are more young people learning and desiring to farm.  I feel like there is an avenue to come alongside these people and encourage them on their path.|Possibly a continual combating of false information on the internet that so many people believe.  
540|Master Gardener Volunteer|10+|Female|65+|Opportunities to learn about gardening and volunteering/helping in the community.|Work on retaining members...keep people involved.|People are more interested in living in 'green' spaces...more focus on this|Funding, people are too busy to devote time to MG's
541|Master Gardener Volunteer|0-5|Female|65+|sharing info with people in our communities|We need to get to online tracking of hours; no suggestions on elimination|Ensure sharing of success stories and encourage communication between groups to leverage each others efforts|an obstacle is getting people to become MGV's and be active.  There may be some perceived competition from businesses doing classes/seminars.  I think we can turn that into partnerships where we collaborate so each provides helpful information
542|Master Gardener Volunteer|43595|Female|45-64|I like to keep my membership up but I find recording hours time consuming. It would be nice to have an online way to record hours.|I don't have a suggestion for this question.|I would like to see more advanced training that involve us with citizen science opportunities.|I don't know of threats but other programs that exist like Master Naturalist and Citizen Science opportunities to get my attention. 
543|Master Gardener Volunteer|10+|Female|45-64|SEWMG does the plant sale from planning to digs to potathons to sale execution extremely well.  Quality control and jumping worm awareness is very important and done well.  Very well organized and well executed.  I enjoy helping to sell quality product to happy customers and raise significant funds for the organization.  I also enjoy the community service aspect and have focused my volunteer hours on projects visible within the community (Boerner Botanical Gardens primarily)|The long-tenured and very experienced MGVs sometimes come across a bit strong which can be off-putting especially to newer MGVs.  It has always been challenging to get the volunteer and continuing ed hours while working full time, although I am happy to see some recognition of this finally and additional programs available evening and weekends.|There is opportunity to continue to educate and provide food crops to under served and under priviliged areas.  It would be worthwhile to explore whether community service hours that include general cleanup, so very much needed in the City, perhaps of parks or other common areas, making sure that it is known that the MGVs are volunteering, which should be helpful when the Governor is considering budget cuts.|Budget is the only threat I'm aware of.
544|Master Gardener Volunteer|0-5|Female|65+|Level 1 MG training was excellent. Online resources informative, easily digestible and easy reference for future needs. I love working with my MG classmates and the more experienced local MGs.|I’m not really sure. I haven’t been with the program long enough to make that evaluation. So far it has all been good. I would like a way to provide feedback to you in the future if I experience something that I feel needs improvement |Perhaps each year there could be a focus on something, not excluding anything but featuring some aspect. Then the local clubs could incorporate |I don’t know, but I have found something that needs improvement - the software for this survey. It allows only one visible line to type d if you stop or get interrupted like I did on the last question, there is no way to go back and continue your answer. Very irritating! FYI i am complet Urey on an iPad.  He is the possibility of too much bureaucracy and rules to the local chapters making members rethink their participation. This is supposed to be enjoyable, educational and sharing our knowledge
545|Master Gardener Volunteer|10+|Female|45-64|Diversity of volunteer opportunities; education for MGVs is thorough and provides an excellent base of knowledge|"Would like more opportunities to visit local gardens and learn more about the ""behind the scenes"". Tough to do when I (and many other MGVs) work full time. Difficult topic, I know...."|As a group, have we explored opportunities to work with/partner with individual cities and towns on education and engagement by MGVs and residents? E.g. local education, community garden oversight, etc.|The tracking of hours on a manual basis is antiquated. I know there's a change coming and it's long overdue. Also the overall age of the membership is a bit of a concern. Are we picking up new members at an equivalent rate as we lose MGVs who choose to not continue being active?
546|Master Gardener Volunteer|0-5|Female|65+|Offers science based gardening information.|Uncertain, as I am a newer MGV, and feel I have yet to utilize all that is available.  |Farmers markets are more popular and a good venue to routinely talk up such things as over use of pesticides, such as public education regarding the detrimental effects of overuse of antibiotics.|Private garden clubs, the Green Team, and others that disseminate information that may not always be science based.
547|Master Gardener Volunteer|0-5|Female|65+|Educates both mgv's and public. The gardens are a wonderful medium, both for public viewing and for educational opportunities|I'm too new to know...2years|I'd like to see groups helping at small sites..charitable group home, churches, maybe homes if disabled/elderly. No  official $ need be outlayed. Thise mgvs with interest could work independently, usually doing cleanup work. |n/a to me..only mgv for short time
548|Master Gardener Volunteer|0-5|Female|65+|I like the way we are educated and made aware of all gardening issues. By attending continuing Ed programs, postings by email, and learning from fellow master gardeners, especially working at digs and potathons for the annual plant sale in Milwaukee|I am very happy with the program the way it is.|It’s unfortunate that the majority of the program is made up of mostly retired people. But to gain the younger members it is so hard because their lives are so busy with work and families which leaves them with little free to be active in the program. |Age is a factor and I really don ‘t see any other competitors. Master gardening is a chosen commitment.
549|Master Gardener Volunteer|10+|Female|65+|Educating|Nothing|There are plenty of opportunities |Local Extension offices are often not appreciative of what the Mgs offer to the community 
550|Master Gardener Volunteer|10+|Female|65+|Education is one top strength of the Master Gardener Program, beginning with the first training classes, and on through the continuing education classes.  This is then applied to the MG gardens and committees, where we share this knowledge with others and help them to manage and enjoy their own gardens. |"There are more educational opportunities which should be considered ""approved"" for master gardeners."|We need to address gardening trends and skill levels of all ages.|As with all groups, the master gardeners are aging and not able to garden as they used to.  Also, younger people are so busy with work and family, that they don't have time to garden. 
551|Master Gardener Volunteer|10+|Female|65+|learning|more classes|yes|none
552|Master Gardener Volunteer|43595|Female|65+|Eduction, Staff (Alfuth), organized.  Working on community projects excites me|Wish meetings could be during the day.  Increased technology..example using Skype to allow volunteers to attend from home or to capture and let us watch at our leisure.|"Using more technology to reach more people.  Being a ""click"" away"|Time is always the competitor.  
553|Master Gardener Volunteer|0-5|Female|45-64|I like the many opportunities to volunteer on various projects throughout the community. The people are very nice and helpful. The learning opportunities are endless.|Hard for me to evaluate at this time because I am just starting out.|Possibly working closer with various businesses to improve the aesthetics of the community.|Budgets and funding.
554|Master Gardener Volunteer|0-5|Female|45-64|The program constantly exposures new material and ideas|more winter programs|rooftop vegetable production|more pull from community events for volunteers time 
555|Master Gardener Volunteer|10+|Female|65+|To talk garden with others.  Garden fellowship |It runs fine I don’t know improvements |I dk|I dk
556|Master Gardener Volunteer|10+|Female|65+|Continuing Education that’s available through local chapter, Botanic gardens and UWEX.|Chapter leadership and development skills are lacking.  |As an educational topic: Climate change in Great Lakes.  How to control runoff, gardening with more heat tolerant plants. |There is little info and too much separation between the Master Gardener and Naturalist programs
557|Master Gardener Volunteer|10+|Female|45-64|we have good speakers and tours held once a month|I like the program , my frustration is more to do with other members-seems like it is a certain few members that do and organize activities and many that don't.|there is a trend toward school gardens with a great need for Master Gardeners to be present nearly all the time otherwise it fails.|Not always a clarity on rules and guidelines on the hours members give.  
558|Master Gardener Volunteer|0-5|Female|45-64|Community focus, opportunities to network and meet new people|how can we better engage current members and attract new|lifestyles are busy; find ways to attract a younger population - what is the average age of current MG members|We need the support of the State to keep the program running 
559|Master Gardener Volunteer|43595|Female|25-44|Educates volunteers extremely well and is organized!|My only issue is that because I’m still working, I would like volunteer opportunities and classes advertised much earlier than they are so I can take off work to attend. I miss out on a lot bc of short notice announcements and my job. |I think the MGV program needs to be on social media. Facebook and Instagram. Hashtags are a great way to lead people to what we’re doing. |Unsure 
560|Master Gardener Volunteer|10+|Female|Prefer not to respond|We are trained to know where to look, whom to ask in order to help the public.|The documentation, background check and mandated reporter things are cumbersome, but I understand why they are there and why we have to have them.|Our county MGA speaker's bureau|This isn't a problem for me, but many potential and current MGs only want to 'play' in the garden. They are turned off by the narrow parameters in which they feel they have to work. As a result, some have left the organization and just volunteer directly with the project, or have joined the local Garden Club.
561|Master Gardener Volunteer|10+|Male|65+|Commom location to find out the latest information on gardening and related topics|I have vegetable and herbs interests|provide research tested options and opportunities|Budget and staff cuts!
562|County Coordinator/Educator|0-5|Female|25-44|Bring knowledge to WI's communities|Not enough focused on urban gardens|Spanish Language Programs. More in depth on one topic vs. a little of everything|Slow to modernize
563|Master Gardener Volunteer|0-5|Male|65+|The educational program in traiing is good. The interaction between gardeners and the community needs help.  Just a having  pretty garden spaces does not cut it. |mmore involvment in the pollinator aspect of of gardening in schools.....|more community in dept involment with growing gardens that feed people|toomuch vertical management
564|Master Gardener Volunteer|0-5|Female|45-64|Classes are great, many different opportunities to help the community |A few more after the master gardener course classes|Work on increasing the use of natives|Young gardeners,those just buying houses, thinking about gardening. A few real beginner classes. Annuals vs perrenials, how much sun do different plants need, 
565|Master Gardener Volunteer|0-5|Female|Prefer not to respond|Being able to learn with others who are passionate about gardening.  |I'm new so I don't have any suggestions at this point.|not sure at this time due to inexperience|i can't think of any
566|Master Gardener Volunteer|0-5|Female|45-64|Community resource, horticultural education (MG certification and workshops)|Nothing|No opinion|Funding?
567|Master Gardener Volunteer|0-5|Female|65+|"The MG program is highly regarded and MGVs are depended on to provide solid advice about gardening. Gardening is a big deal to so many people, and even though there are online resources at peoples' fingertips today, I find that most people are more confident getting their information from a MG. In addition to gardening, I have found that being a MG has opened up my life to knowing a group of caring, warm, genuine and sincere people. This group is hands down some of the best people I know; they are indeed ""down to earth"" and don't mind digging in and getting things done! We are considerate of each other, kind, and work well together, and have a common interest/passion.  "|Cannot think of a thing.|In Marathon County, horticulture therapy has been introduced by our Advisor. I think this is a perfect example of a new opportunity that is being embraced.|I was very glad that the mandatory criminal background checks are required. It is important to keep the program clean of any scandals or bad press. And also important is remaining visible in the community as a distinguished organization, particularly to ward off untrustworthy and disreputable businesses.
568|Master Gardener Volunteer|43595|Female|65+|knowledge based curiculum in which to volunteer. |I prefer the person led education. Some longer, more in depth programs|obtaining some younger people|satisfying everyone.
569|Master Gardener Volunteer|0-5|Female|65+|The program is great at sharing plant information with interested parties.  The members are very enthusiatic about gardening and want to share their knowledge.|Need to find more ways to get the Master Gardener message to the general public, to those people who are not dedicated gardeners yet, but may have an interest in a specific topic.|Increase focus on edible gardening, vegetable and fruit, healthy eating. Continue out reach to youth gardening.|Funding concerns. Getting kids and youth outdoors into gardens.  I'm thinking of the LL Bean ads that show people outdoors enjoying sports, other than ads for home improvement stores who are selling plants, what companies have ads that include gardening as an outdoor activity, versus sports, hiking, etc.
570|Master Gardener Volunteer|43595|Female|45-64|Training, Volunteer Opportunities, Communication, Sense of Community|Sometimes is difficult to find out who to contact about certain volunteer opportunities (contact info isn't always available online)|Not sure - the program offers many opportunities to be involved as a volunteer and keep learning|Not sure who competitors are. Lack of funding and/or strong support/leadership could be threats.
571|Master Gardener Volunteer|10+|Female|65+|help the community with landscaping projects. Working with children excites me. |too much paperwork and reports. It's had to find leads because of the paperwork.|Seek opportunities to teach gardening to children and the general public. |see more and more micro management. 
572|Master Gardener Volunteer|10+|Female|65+|Provides excellent speakers at monthly meetings; Presence  to answer questions in public venues; answer questions at the Extension Office|Needs a coodinator at the Extension Office to oversee the entire program,. develop a plan to recruit new members especially those who are younger|Increase use  of the teaching gardens at the Extension Office - perhaps work with school districts who have summer programs and get them involved in the teaching gardens; continue promoting and helping with community gardens and neighborhood gardens; more workshops outside the monthly meetings to get people interested in things such as pruning, buttefly gardens, awareness of new plants for the area and any thing new that has been develped or has become a trend|Members are aging and unable to do everything they could do before, no one to replace them on service projects in the community that are expected to continue, women are working and have less time to volunteer. individuals going through the training programs do not seem to attend meetings or continue doing service projects as they once did
573|Master Gardener Volunteer|10+|Female|65+|Provides educational opportunities for MGVs and community of gardeners|"The volunteer aspect of the program is not as well-defined as the gardener aspect.  Also it is considered by some to be only a program for older people who are ""experts"".  Emphasizing MGV as a volunteer program in horticulture and connecting via social media could attract younger volunteers."|The use of online video sessions has increased the reach and quality of training.  Opening this up to the public could make this program better known.|Many MGVs seem to bristle at the requirements for volunteering (CBC, hours reporting) - is there a category or a way to embrace folks who don't want to be certified but want to volunteer with the program?
574|Master Gardener Volunteer|10+|Female|65+|Educational aspects of learning and teaching excites me especiaaly working with kids. |you programs. I have never taken a level 2 course because they are offered on line. That doesn't mean I would not take one if offered otherwise. |of this type of learning. |Cut backs of personnel in the UWExtension offices--the MG's support system espcially on the local levels.  
575|Master Gardener Volunteer|0-5|Female|45-64|There is a cache of saying, “I’m a master gardener.”  The pride and care that the various volunteer gardeners put forth is impressive.  There are many opportunties do volunteer.|There is a cattiness to some of the gardening leads (Patti Witt, for example) that turns off others from being involved. The required hours are tough for those who are not retired. It seems to be a program built exclusively for retirees.  The depth of the training was weak.  More continuing ed opportunities with qualified instructors like Dr.  Death are needed. |Need to prepare for the demographic shift of boomer gardeners being able to contribute less physically. Also open the door to the next generation, tapping into environmental work. |Not sure beyond perhaps professional landscaping, nursery organizations to a very limited extend.  It seems the complexities of the UW extension system itself are its own worst enemy.  I’m very confused about what merged with what and who and where I belong.  Previously, Sharon was very territorial and prescriptive of the SEWMG identity. I don’t think that’s the way to go, but it was clear. 
