ID|Role|YearsExperience|Gender|Age|Strengths|Weaknesses|Opportunities|Threats
1|County Coordinator/Educator|43595|Male|25-44|Provides an outline of topic and activities to cover during the training|Methods to collect data for annual summary - I believe you are on the right track with the new reporting system|How to get younger volunteers (i.e. millennials) or methods on how local educators can use younger volunteers in program work|How MGVs interact with garden clubs.  There can be synergies if done correctly and disastrous if not.  
2|Master Gardener Volunteer|0-5|Male|45-64|Can't on cell|Too much spam mail|Help improve the world|None
3|Master Gardener Volunteer|0-5|Female|45-64|Teach the community |Stagnation of county MGV leadership ideas|So many opportunities are brought to the MGV's from the community & membership. It would be nice to expand the projects our group is involved in. |Again, stagnation of the county MGV leadership (in programs, ideas and clicks)
4|Master Gardener Volunteer|10+|Male|65+|educate the public|more education opportunities for the volunteers|more involvement in invasive issues|lack of timely education for members
5|County Coordinator/Educator|43595|Female|25-44|Educates, trains mgvs well. The curriculum and materials of level one are well organized, and comprehensive.  The feet on the ground, doing work in our community, and projects carried out improve our state immeasurably. |I think that there are some communication gaps, at times. |Id like to see more projects feeding communities. |Atleast up here in the northwoods, short garden season, and information is difficult to reach people, recruit with. 
6|Master Gardener Volunteer|0-5|Female|45-64|I am a very new master gardener and I am excited to learn a ton and get my hands dirty.  Very excited to help!|NA|NA|NA
7|Local support staff|43595|Female|45-64|The program does several projects throughout the community.|Establish better timelines for meetings. Sometimes, things do not get accomplished in the time span they have. The Master Gardeners need to stick to their timeline.|New members on the board, need new ideas, continue to offer Master Gardener classes|I do not see any competitors.
8|Master Gardener Volunteer|43595|Female|65+|garden conferences|need more educational meetings|online education opens up new opportunities|don't know
9|Master Gardener Volunteer|43595|Female|45-64|"Monthly programming, annual plant sale, online ""classes"" and information from UW Extension"|Programming is at local level. Would be nice to share programming that other MGs are doing throughout the state.|Younger people getting involved. More community focus on people who aren't necessarily MGs nor want to be. However, grow food. Is there a trend towards backyard gardens again?|People aging. Not advertising ENOUGH…the online resources. 
10|Master Gardener Volunteer|10+|Female|45-64|community-based support, interesting training program|"I don't feel qualified to answer this.  As a volunteer, I would like more demonstration training in the teaching garden so that when I am talking to neighbors or other interested parties, I feel confident about what I am saying as a ""master gardener.""  Even short videos sent to us would be fine"|Gardens in food deserts, Cooperative work with food pantries, Beautification of low income neighborhoods and forgotten areas of the city|I don't see them as competitors but there are other good teaching programs at Olbrich Gardens
11|Master Gardener Volunteer|0-5|Male|25-44|Teach local people how to help other local people with gardening questions/problems/ideas.|Continued yearly requirements to keep certification active instead of multi-year certification.|Kickstart the support of new public gardens with support packages/plans.|Decrease in funding
12|Master Gardener Volunteer|43595|Female|45-64|Connecting community members with gardening and food-growing resources|DIVERSITY and general outreach, long-term engagement of MGVs|Again: diversity (of ethnic groups, but also of income levels, gender, age). Also, food security, land stewardship|Threats to funding, of course. Other than retailers, I don't see that we have true competitors. If this program went away, there wouldn't really be anything to fill the gap
13|Master Gardener Volunteer|10+|Female|65+|Keeps me up to date on some new horticultural developments.|Not sure.|More educational activities.|Don’t know.
14|Master Gardener Volunteer|0-5|Female|65+|Demos|Bookwork|Individual progress|Time constraint s
15|Master Gardener Volunteer|43595|Female|45-64|Sharing the love of gardening with the community - conference, plant sale and library presentations. I enjoy learning from fellow gardeners.|Nothing comes to mind. As with any group, politics and lack of enough volunteers for a task come to mind. However, politics and personalities is what makes a group. We haven't experienced over taxation of our volunteers although some wait until the last minute to volunteer. These aren't weaknesses of the Program but of human nature. |Technology is always progressing and incorporating that into our paperwork, education and other aspects of the organization. Younger people will relate easily to technology. Older people will appreciate the help of technology.|First obstacle that comes to mind is lack of autonomy. Guidelines and rules are helpful in keeping a group on track but each region has its own strengths and characteristics. These should be embraced without choking the group into submission to be a cookie cut from the same cutter.
16|Master Gardener Volunteer|0-5|Female|65+|very much enjoy the educational component of the program|I think we are involved in too many small, very focused projects. The large number of projects creates difficulties for a relatively small association like ours with <100 members.|Sustainable gardening and education and support of the same locally and statewide.|We are having a difficult time attracting younger members. When people retire, then they are available for about 15 years before they are tired of the many demands MGV make of them.
17|Master Gardener Volunteer|0-5|Female|65+|Landscape course offered. Choose projects to be involved with. Educational programs.|Nothing to be eliminated. Still new to the program.|Become more involved with local community to help with diseased trees, etc. |No threats that I know of.
18|Master Gardener Volunteer|0-5|Female|25-44|Provide a good expanse of knowledge and share it with the community|Limits of what is counted as continuing ed|online reporting!|none
19|Master Gardener Volunteer|0-5|Female|45-64|Presents information to master gardeners who can supply to the public|I like how the program has been run, I like choices of volunteer opportunites. I don't find anything to change|I think joining more with other groups that have the same goals will strengthen, such as local organizations like Kettle Moraine Land trust or Wild Ones|I think wrong information that people get from the internet.  Competitors are probably the nursery owners but I think they could be an asset to spread more good information.
20|Master Gardener Volunteer||Male|45-64|I am actually of stepping out, after attending some of the volunteering stuff, at this time I have more than enough with my own two acres of perennial / wild gardens to maintain. |n/a|They don't include anything for your own community that have projects to maintain or improve.|actually learned more taking small classes at NWTC and Quahiums True Value in Shawano
21|Master Gardener Volunteer|0-5|Female|45-64|I am excited to continue learning and volunteer where I am able.  Maybe we have a place and I don't know but would like to be able to log on and see a list of volunteer opportunites that are always coming up.  I work very full time so something quick to know where help is needed would be nice!|Don't know enough really to comment other than the volunteer opportunities.|unknown|technology, need for use vs. set up in past?
22|Master Gardener Volunteer|0-5|Female|25-44|Education/Learning|Not enough online communication & coordination at our local level.  Volunteers feel lost.  Program Chairs feel like they’re not getting enough volunteers. |We should be more proactive as an organization to embrace & encourage environmentally sustainable practices.|Locally, the Wausau Area Garden Club & Thyme Keepers are competing organizations.
23|Master Gardener Volunteer|0-5|Female|65+|Serves the community|The structure, reporting, management and decision-making is opaque even though I have actively tried to understand it.  It is difficult to determine who to ask for what.|We could try to brand ourselves as the go-to site for public education. Perhaps we have but it is difficult to see.|Sourcing income given the competition for members' dues, public money, sales, etc.
24|Master Gardener Volunteer|0-5|Female|45-64|It has been a great learning experience.  I have met so many people in my local area that I would not have known.  Iam  so aware of the land veg, and all plant life eat more than I ever have been.  I also have helped out in local schools and local gardens.   Now I was given a acre of land to try new plants and vegetables on, dirt if a test area.    I feel I need more identification as I go out to the public.  I know iam in intern stage but would like to have maybe more of a visual for people.  For example a magnet sign on my car for going to locations, shirt, bag. Things that give people sign of my.   The program is great!  I think we need to work on getting more people interested ie milenials.  I think some of the master gardeners need s little pick me up.  I will when iam a master gardener I will make sure at events and things that the interns are given a Warner and helpful greeting and help with new programs.|More people, give it hours that younger people can attend   |Again to open up more opportunities that are sponsored   It is great what we do Nd and do many people are superseded when I tell them|I find that a lot of current mgv need to be a bit more friendly with the public.  Big garden stores like milaegrrs
25|Master Gardener Volunteer|0-5|Female|25-44|The amount of science supported information that is specific to Wisconsin is spectacular (i.e. learning store online). The master gardener volunteer level one classes were fantastic!! The promotion of community involvement is also good.  |.|.|.
26|Master Gardener Volunteer|0-5|Female|25-44| A|A|A|A
27|Master Gardener Volunteer|0-5|Female|45-64|To me, the program is highly depended on a few experienced gardener volunteers who have taken it upon themselves to be the leaders. Key, among this group is Claudia. I'm not sure I would have stayed in the Program without her projects and leadership|Perhaps more of an emphasis on educating youth.  Even though there is a time requirement, I think we should sponsor the Scouting Merit Badge and perhaps enter some science classes|Create a nature walk around the Neville, stemming from the new garden.  Conduct periodic walking tours for kids during the summer and a patch in the back could be for the scouting Merit Badge|Threats:  Dependent on a few skillful volunteer leaders; age of members. If we strengthen the educational component we might be able to secure some grants for additional funding
28|Master Gardener Volunteer|0-5|Female|45-64|  The knowledge learned in the course was valuable,PLEASE consider more hands on learning, whether at Boerner or in other gardens.Wide range of topics offered for CE’s is great!|Once the plant sale preparation is under way, it would be very nice if only those who choose to be involved would get the VERY frequent emails. The amount of emails generated in general seems a bit excessive .|Please continue to offer a wide range of experienced speakers|I question how long this organization will be able to have as their fundraiser plants from private gardens as long as the threat of worms continue to be discovered statewide. I have heard it said many times from others that they will not purchase from the plant sale. It is just a matter of time before the gerneral public will be reluctant to purchase as well
29|Master Gardener Volunteer|10+|Male|45-64|Good volunteer opportunities. Community education programs are excellent|"Too many people with too many differing opinions on small matters. It's like living in the ""real world""!"|Continue to be involved in community education in an ever-growing capacity.|Tough to get young gardeners involved, although Millennials are starting to wake up!
30|Master Gardener Volunteer|0-5|Female|45-64|Volunteers Knowledge of gardening practices and plants|No central focus/direction.  Old role as garden maintainers instead of teacher/consultant.  Lack of volunteers willing to do more than bare minimum.  Reputation as needing garden expertise to join|More teaching garden classes for community, speaker guild, directed walks at parks or vols gardens, |Poor online pages.  No interconnected cty relationships.  No consistent policies.  WI Garden Club as competitor. Lack of consistent level 1 classes in some counties.  Aged volunteers base. 
31|Master Gardener Volunteer|0-5|Female|45-64|Spreading beauty to Wisconsin, encouraging pollinators, butterflies, birds, etc. and helping others to do the same.|The only thing to improve is to have the ability to pay dues online.|More butterfly habitats to help populations that are in dire circumstances.|Global warming is a threat to all gardens and wildlife.
32|Master Gardener Volunteer|0-5|Female|65+|Educational enhancement is excellent |Paper redundancies|Increased use of technology for dues collection and membership lists|We have an aging group.  We need to encourage younger participants 
33|Master Gardener Volunteer|0-5|Female|25-44|Educates and advocates in the community|The education requirements for volunteers is difficult to accomplish, the projects to work with cater to retired folks and teachers who are all free during the day in the summer, its difficult to find projects as a young working adult|There is a strong back to the land movement going on with the younger demographic, this has the potential of pulling folks into the program|available resources for younger demographic
34|Master Gardener Volunteer|43595|Female|45-64|Has good volunteers|MG seen to go unnoticed,  Mother umbrella seems very disorganized.  Need some good educators now that they are all gone.  Go back to a majority of training in person not online.|not sure|Not being able to attract MG.  Count seems to have gone down
35|Master Gardener Volunteer|0-5|Male|65+|Youth programs and continueing education|Transparency, county association board does not release minutes or provide any feedback to the membership. A clearer set of rules and regulations from the state office would also be appreciated.|Provide local school teachers with in class support for horticultural topics.  |Turnover due to aging membership,people who are not retired due not have the time to devote.
36|Master Gardener Volunteer|10+|Female|65+|Volunteer opportunities in community doing what I enjoy.|Most volunteers in my sphere tend to be older with little or no new young people joining due to family and work.|Youth!!!  Young families looking to make healthier choices.  Intergenerational workshops or classes.|People in my area see us as a bunch of retirees.  For youth our competitors are 4-H & Scouts.  Maybe a youth Master Gardener program in those organizations would be beneficial not just one time experiences.
37|Master Gardener Volunteer|0-5|Male|45-64|helps educate the public/serves community|i would improve the initial training to emphasize science|there is an opportunity to support efforts by the people who work in the Farm to School programs-this should be a point of emphasis|no competitors really, the only threat to the program is political
38|Master Gardener Volunteer|0-5|Female|65+|Educating and interacting with the public|Some programs are strictly maintenance, not educational. Too much focus on fundraising without member input.|Healthy food movement. Jioining forces with or including foods classes for utilizing fresh produce. Focusing on trends toward urban, rooftop, and window gardens as well as the large small town or rural gardens. Joining forces with schools to teach children about healthy foods and growing even tiny amounts of their own healthy food.|Unsure
39|Master Gardener Volunteer|0-5|Female|45-64|I am new to the program, the course was very good.|Unable to answer|Unable to answer |Don’t know
40|Master Gardener Volunteer|43595|Female|65+|learning about plants that I grow and eat, going to different gardening events|i can't think of any weaknesses|Enjoying the membership of our group, being able to learn how to talk to large crowds|I can't see any threats
41|Master Gardener Volunteer|10+|Female|65+|Provides great educational opportunities to its members|I have never understood why we are involved in some of the gardens that do not appear to be open to the general public, such as nursing homes.|Be more accessible to the public to answer their questions and concerns regarding gardening.  I have friends and neighbors that never knew the depth of info and knowledge that is available to the public.|the demise of small run nurseries who may actually tell you about resources at MGV and the increase of big box selling plants with minimal knowledge.
42|Master Gardener Volunteer|0-5|Female|25-44|I'm a pretty new master Gardener (my first official year) and I really enjoy all the information that's available to us either online or other members who are more seasoned than I am.|I can't think of anything that jumps out at me but sometimes our local meetings run pretty late and it's hard because it's during the week and I have to work the next day. Our start time is 6:45 and sometimes I don't leave there until 9:30pm.|I think the master Gardner's need to reach out to the younger generations and get them involved. I'm one of the youngest volunteers at 26 and there's probably a 10-15 if not more age gap between the other members and I.|None that I can think of. In our area we don't have anything similar to this program.
43|Master Gardener Volunteer|43595|Female|45-64|Allow master gardener volunteers to work within their communities assisting with garden beautification, native landscape restoration, and other value-added projects.|Provide support for county extension agents in the way of additional programmatic support for building the master gardener program. Often times the county extension agent is overextended and can't provide the support needed to the ground. It would behoove the program to add additional staff in the way of part-time employee who could provide on-the-ground planning with the master gardener cadre under the direction of the county extension agent.|Provide funding and technical assistance to design table top displays that can be used to go to market this opportunity at fairs, etc. This will strengthen the brand image of the program and help with recruitment. I've seen creative designs from different master gardener groups throughout the state. It would be helpful to have one design instead of dozens. Additionally, provide some latitude for county extension agent projects that master gardeners can do. Our master gardener group works on projects throughout a two-county area and helps numerous small community garden projects. It was recently proposed that there would be more restrictions on project selection. This could impact our rural communities adversely by restricting the number of projects we can assist with. |There may be opportunities to collaborate with the Wisconsin Master Naturalist program. We have crossed paths with their volunteers at projects more recently. Perhaps this is an opportunity to cross-pollinate? Not sure what the mechanics of this would look like.
44|Master Gardener Volunteer|0-5|Female|45-64|Opportunity to get involved in various aspects of our local community|I'd like to see a lot more educational programs.|I think the more we can learn the better we can educate our community|Don't see any competitors just internal obstacles of a little disorganization and lack of documentation (reinventing the wheel on various projects)
45|Master Gardener Volunteer|0-5|Female|65+|Education on varies issues. Friendly people. |Communication. |Community involvement and education|Leadership from the Extension
46|Master Gardener Volunteer|43595|Female|45-64|The Volunteers|Communication between State and Associations. |More involvement in community, |Need younger volunteers, program seems geared to older people 
47|Master Gardener Volunteer|10+|Female|45-64|Coming together with fellow gardeners to provide education for the community.|The ridiculous requirement of submitting social security numbers to a private, for profit company to conduct background chekcs.  Our county lost over half of our volunteers and we have had to drastically cut back on our programming.|Interest in vegetable gardening.  If we had more master gardener volunteers we could incorproate veggies into display flower gardens.  But since we lost half of our volunteers, we are abandoning many of our established flower beds around the county.|Biggest threat - requirements from Madison that hinder instead of support county based programs
48|Master Gardener Volunteer|10+|Female|65+|Does well: sharing research based information with gardeners; Excites: Gosh, almost everything!!|Can’t think of anything at the moment|Educating public about effect of climate change; promoting better use of resources; |Competitors: “google it”!! It really isn’t an obstacle as such, but I field so many inquiries about “home made” concoctions. So, if we are in the forefront of information and web searches that would be good.
49|Master Gardener Volunteer|43595|Female|45-64|Always learning new ways to improve my gardening expetiences and relaying that information to others.|I'm not always selected for projects I volunteer for, even though i provide a prompt response. I feel that perhaps I need to send a bio along eith my request or perhaps I'm not in the right clique.|Home trial gardens, encouraging more edible landscaping, therapy gardening|When volunteer opportunities arise, perhaps a deadline to respond, so everyone has an equal opportunity. Some slots get filled before opening the email!
50|Master Gardener Volunteer|0-5|Female|45-64|Unite us as a community to be knowledgeable & support needs in our community|Tracking hrs- improved already|Need more volunteers- & assess needs of community for different ways to volunteer|Uncertain
51|Master Gardener Volunteer|0-5|Male|45-64|providing direct support to community members thru personal contact and concierge type information with direct answers to problems and interest items |Additional online resources- you can never have enough|online access is wonderful but potential is unlimited|local gardening clubs which do not apply same restrictions such as jumping worm identification
52|Master Gardener Volunteer|0-5|Female|65+|The program trains mgv’s and provides excellent continuing education. |Funding for all the great ideas is an issue. There doesn’t seem to be a focus or direction. And my pet peeve is the expectation that we do landscaping tasks without the equipment of a landscaper. |I haven’t been around long enough to see the future. |I don’t see many direct competitors. Nobody else does this stuff for free. However, most volunteers find a lot of demands for their time. 
53|Master Gardener Volunteer|0-5|Female|45-64|Education|Unwillingness of older members to embrace new ideas|Embrace social media|In Wausau, we are in competition with Monk Garden.  We don't have brand identity and outsiders think we are one in the same. 
54|Master Gardener Volunteer|0-5|Female|65+|The classes taken in order to become a Master Gardener Volunteer were excellent.  There is so much information.  I wish I had taken this class many years ago.  I have met many people with interests like mine and enjoy doing projects with them.  I am always learning something new.  I have been involved in our plant sale in research, selection and sales.  Our proceeds allow us to offer classes to the public which always appear to be well attended.  I have been working at the Garden Door in both the Fairy Garden and the Raised Bed Garden.  Socializing with all of the other gardeners has been a wonderful experience for me.|I realize that many of our volunteers are in my age bracket range.  It would be nice to be able to draw younger people.  I suspect that this could be due to the fact that our entire area's population is older on the average.  I am also just thinking that many younger people are still working and have families to care for.  This might be the reason why we don't see a lot of participation by younger people on the peninsula.  Personally, I am not involved in this program with 100% of my time.  I pick and choose what I participate in based upon my time and whether or not I have to drive a long ways to attend a gathering or an assignment.  |I have only been involved for what will be 3 years.  I don't feel I have the expertise or knowledge needed to address this.|I am currently unaware of any obstacles or competitors.
