ID|Role|YearsExperience|Gender|Age|Strengths|Weaknesses|Opportunities|Threats
157|Master Gardener Volunteer|43595|Female|45-64|Educating the public , sharing knowledge , and supporting them to find answers to all their gardening needs . |Often at events there is not available literature to hand out & announce the MGV program|Need to educate our young , getting into the schools and sharing|None
158|Other|43595|Male|45-64|The use of technology.|Continue to leverage technology in new ways|N/A|Broadband access in more rural areas
159|Local support staff|10+|Female|45-64|Educate members about different aspects of gardening.  Wide range of topics are offered and taught.|I would like to see a little bit more of botany lessons and more on hybridizing.|Need to understand what is happening with the bees?  Natural ideas for preventing herbicides and pesticides. |There are local garden clubs; but I don't think they are a threat.  Mostly share programs between both.
160|Master Gardener Volunteer|10+|Female|65+|RacineCounty MG program was working well  over the last few years we have lost leadership support. Many good volunteers are leaving the program |Give us a horticulturist who can lead and support us |More work with youth and County wide opportunities. Example. The Racine Zoo would love to have MG to return |Too much concern about volunteer hours. We have lost sight of the big picture. Also too many rumors about rules and regulations and no leader to aid in determining answers   We currently share a three County leader who can give Racine 1 day a week. She is a fine person but is not a horticulturist .  We are not going to grow under these circumstances  .
161|Master Gardener Volunteer|10+|Female|65+|continuing education on topics related to gardening; brings info about the joy of gardening, landscaping, etc to the wider community; opportunity to meet with others who share my enthusiasm.|more uniformity statewide in qualifying activities for yearly required hours of education and support services|Citizen Science big opportunity; climate change and how communities and individual gardeners can adapt |competitors include large garden centers that have seasonal programs, bus trips, etc; botanical gardens that have similar educational programs; internal threat UW priorities that may change and demote MGP
162|Master Gardener Volunteer|43595|Female|45-64|I just love all the programing. The seminars, talks, workshops etc. |I would like to see a greater amount of programing conducted in the evenings. I often cannot attend a program as I work full time. That is frustrating. |I think the MG participation in school gardens is excellent. I would like to see this expanded.|The biggest threat is funding. 
163|Master Gardener Volunteer|10+|Female|45-64|Master Gardeners are the bridge between unpaid experience providers and the general public.  We host events that homeowners, families, and individuals can look to to enlighten their lives and experiences in growing food, enhancing their yards, or teaching children.  We are a trusted source for problems that can save UW Extension staff time and energy to solve problems.  We are asked by businesses and community leaders to donate our time to help where funding simply is not available.  |"Please stop questioning us and making us ""prove"" our worth.  Gardening is a basic need and should be a life-skill that is rarely taught yet highly revered.  We give freely of our time and expertise and it is humiliating that our efforts are being scrutinized instead of honored."|"The trend should be ""let's promote the efforts of those who are making a positive difference already in their communities!"""|Funding has scaled back our program, and the resources for the general public.  Is growing food, beautifying our yards, gardens, cities and the planet becoming obsolete?  Or should we pour efforts into self-sustaining ways in both food and waste management?
164|Master Gardener Volunteer|0-5|Female|65+|There is so much variety in what is available for volunteer opportunities so a nitch for everyone.|As a MG intern, I don't think I can respond to this yet.|Again, still too new to the program to be able to respond to this.|??
165|Master Gardener Volunteer|10+|Female|65+|1.  provides a forum for the community to gain education  2. provides an opportunity for MGV to give back to the community in expanding community garden venues in a native to the area way  |There should be a way to make it more attractive to those volunteers that work ie hours venue etc. and yet provide what the community needs.  |education arena -- which could also be the plant hotline|not sure how to answer,  don't know there is a threat.  or competitors.  in lincoln county teaming up with Sustainable living might help in bringing MG program community forwa
166|Master Gardener Volunteer|0-5|Female|65+|Using my interest in gardening in the community through gardening in public spaces and providing education. The program provides good support (educationally and administratively) and provides a wide variety of opportunities to meet volunteers’ interests, talents, and abilities.|This period of transition and uncertainty and the departure of so many long time and beloved staff members has been difficult. Regular communication and transparency about the ongoing process is appreciated.|Diversity is oftentimes mentioned, but our group in Southeastern Wisconsin is anything but. We need to find a way to reach out and open up.|I didn’t ever think about Master Gardeners having competitors. I would rather think in terms of who can we cooperate with.
167|Master Gardener Volunteer|10+|Female|65+|Learning more about plants and gardening|The volunteer categories.  Let everyone do what is right for them|Sponsor enrollment in gardening classes at local colleges/tech schools|Gardening clubs that do not require volunteer hours
168|Master Gardener Volunteer|0-5|Female|65+|involvement in the community, free community education through programs at Crossroads and at the Garden Door, the Garden Door as an exemplary garden and tourist attraction, the camaraderie of the master gardeners, the involvement of the extension agent (Annie Deutsch)|not sure.  I'm satisfied with how things are...|the growth of the Seed Library at the public library|not sure
169|Master Gardener Volunteer|43595|Prefer not to respond|65+|Diagnostic help. “What’s wrong with...”|Number of required volunteer hours|Pass|Lack of local professional support, e.g., horticultural agent
170|Local support staff|0-5|Female|25-44|'-Community service -General public education -Provides a positive face for Extension |'-Volunteer Organization -Finding new members, hitting the newer generation of people|'-Homesteading - Beyond growing (preserving your harvest) -Value added sales and products from your home|'-None
171|Master Gardener Volunteer|0-5|Female|45-64|People centered|Not every county has a group|Touching the local community more|None
172|Master Gardener Volunteer|0-5|Female|45-64|Community outreach|Continued levels of education |Technology-|Farmer markets
173|Master Gardener Volunteer|0-5|Female|45-64|The educational materials are excellent. I particularly like the recent addition of the Plants Plus series.|Not all volunteer opportunities are linked to the stated goal of educating the public. The benefits of being a volunteer are not clearly articulated, making it difficult to attract more volunteers. |Community gardens are increasingly popular and there is a desire by people, particularly millennials, to grow their own food, but a lot of people try it and fail due to lack of knowledge. There is a significant opportunity for the Master Gardener Program to help these people be more successful. |Not being able to attract volunteers and the lack of funding support by the University.
174|Master Gardener Volunteer|43595|Female|65+|Education |Not sure|Bringing in younger volunteers |Many other options for education and volunteering in the community 
175|Master Gardener Volunteer|10+|Female|65+|Getting gardeners together to share their skills. knowledge, abilities|Currently to much intervention by monitor/Ext person|Education of children - the future of our program|Garden clubs seem to be competitive
176|Master Gardener Volunteer|0-5|Female|45-64|Excellent Education of volunteers, promoting of gardening in the larger community |Improve Quality of continuing education offerings|Interest in locally sourced food, composting, concerns about: climate change, pollinators, clean water, |Is there long term support for the program from the UW system 
177|Master Gardener Volunteer|10+|Female|45-64|I am choosing to answer the question.. what excites me.. being aroung people who talk about plants|it is getting to be too much pressure.. there are more than one way to make things educational |n/a|suggest other educational options.. for people who do not feel comfortable with one on one
178|County Coordinator/Educator|0-5|Male|45-64|The ability to train volunteer extension educators to expand the reach of local Extension office.|dirth of volunteerism training level 1 and later.  State and local assocition relationships|see strengths question|lack of buy-in to the value of the program by local coordinators
179|Master Gardener Volunteer|0-5|Female|45-64|Communication is a strength. I think the training and research articles are exciting. |I think the volunteer opportunities for those of us who work full time could be improved. |Not sure|I’m not aware of any
180|Master Gardener Volunteer|43595|Female|65+|Provide resource materials | The |The|The
181|Master Gardener Volunteer|43595|Female|65+|Helping the community connect with gardening|Diversity|Become more urban rather than suburban|Budget cuts 
182|County Coordinator/Educator|43595|Male|25-44|Delivers a comprehensive horticulture education curriculum to student volunteers and connects volunteers to community service opportunities|Connecting volunteers to programs that serve youth and under-resourced populations and preparing volunteers to successfully support them. |As far as millennials are concerned, the program is clunky. The online training modules are excellent.  The online reporting system is a great upgrade from paper, but that is catching up to where the system could have been 20 years ago.  App development is needed to connect volunteers to online reporting, online training, and to volunteer opportunities. Perhaps it would be a good idea to adopt volunteer management software for statewide use? Also,  the MGV program should continue to insert itself into urban agriculture trends and food systems work|As the population changes to be less dominately white, especially in urban areas, the MGV program is becoming less and less relevant to the public at large. We need to recruit volunteers and connect with community partners who represent the diversity in our communities. And, just like in 4-H, it's time we start broaching the topics of racial, white cultural dominance, white privilege/fragility with our seasoned MGVs.
183|Master Gardener Volunteer|0-5|Female|65+|Broad based instruction, wonderful resource materials, excellent instructors, except one, the new friends I made. |More interaction with other table groups, a walking tour of Boerner grounds, have food delivery bring real dinner food preorders at 7|could be more emphasis on getting schools to have gardens to provide food for students, i.e fruit trees and indoor vegetable|Other volunteer opportunities and limited time
184|Master Gardener Volunteer|10+|Female|45-64|The program's biggest strength is education but a close second is the networking with other local gardeners.|I like it the way it is but I think the online reporting will be good and save time. |Locally sourced food. We can help more people learn how to grow their own. |In our rural area there are no other places the offer the same things. 
185|Master Gardener Volunteer|10+|Female|65+|I appreciate the efforts to increase our knowledge of matters about  which  we might never have known.|Not knowing any alternatives,  I haven't any idea.|Publicity about our programs often brings others to hear about and learn of topics they might be interested in. |Not having an extension agent for our county organization as a coordinator/facilitator isn't good.
186|Master Gardener Volunteer|0-5|Female|45-64|St. Croix Trainer|Communication to public about program|Placemaking|Age diversity. Perhaps youth mentoring?
187|Master Gardener Volunteer|43595|Female|65+|Educate |Have more local experts- not a bunch of volunteers|Because of lack of funding the local experts are now three counties away.|Money and lack of it to fund experts who help each of the counties
188|Master Gardener Volunteer|0-5|Female|45-64|The program teaches the basics well and provides opportunities for further learning through reading materials. It also provides many opportunities for places to volunteer. I am excited to partner with other volunteers to learn and work the gardens.|I do not feel that there is enough oversight by the extension in regards to safety at the volunteer sights and proper use of the volunteers. Example: Ten Chimneys.|I would love to see hydroponic gardening information and initiatives. There is an untapped resource of volunteers over the winter season.|Our competitors are community groups that raise up volunteers. 
189|Master Gardener Volunteer|10+|Female|65+|Training and community service|Ok as is. |No comment|Funding cuts
190|County Coordinator/Educator|0-5|Female|25-44|Brings scientific horticulture knowledge into communities|The training is not sensitive to diverse needs. Many of the gardens/projects don't have any major impact on their communities|Change the level 1 training to be more inclusive. More creative and collaborative project opportunities|Funding match requirements on county levels
191|Master Gardener Volunteer|10+|Female|65+|Training, resources, research-based information, opportunities to interact with the public, ability to work with other master gardeners are all strengths of the program.|Some big projects take precedent over many small approved master gardener projects and there is an elitism that has developed around them that creates an impression that if you're not participating in those projects what you're doing isn't important. I also think there are to many approved master gardener projects in private facilities which to me equates to free gardening services for private entities.|We have to figure out how to attract younger gardeners. We are an aging population. Maybe more presence on social media, more garden work days in the evening or on Saturdays.|The next generation does not seem to be interested in gardening nor do they have the time. 
192|Master Gardener Volunteer|0-5|Female|45-64|Knowledge,evidence base, community outreach|Not sure. |Straw bale gardening|We are in direct opposition with all the crap that is out on the internet
193|Master Gardener Volunteer|10+|Female|65+|Getting much better at teaching HOW to answer questions from the public. What excites me: cheerful people who are willing to pitch in instead of just coming to the fun events, working with others on our projects -- I learn so much while we work and talk.|"I wish the County Boards would ""get"" how much we actually contribute, and support the Ext Office. Many of our members would like ""live"" advanced training classes/seminars/workshops. "|More environmental issues.|That we are perceived by many as a garden club, instead of volunteers for Extension and teaching the public. County Boards affect our program through budgeting - they see us as an expense instead of a value.
194|Master Gardener Volunteer|43595|Female|65+|I appreciate the monthly corespondents plus the educational articles that count towards keeping up my Master Gardener Qualification.  I enjoy the monthly meetings of our local Master Gardeners group and the speakers that are arranged for us and the public.  I appreciate the resources for answering gardening questions.|Need more local level help from Extention staff.  Sorry to loose Matt Coggers position.  Need more help in learning about presentations to gardening groups expected of Master Gardeners.|Community Garden workshops|Funding Resource people I rely on.  Not remembering those of us on the ground working in our local communities 
195|Master Gardener Volunteer|0-5|Male|65+|Education opportunities and service |Improvement in online access to specific articles of information, master index|Coordination with public and private youth organizations who have interest in gardening|Competing community organizations that provide supplies/structures but no education
196|Master Gardener Volunteer|0-5|Female|65+|Deep knowledge of gardening practices, ability to push that knowledge out to others. |Organizational skills at some of the local garden sites. No teaching, just work, work, work. No reason as to why things are being done or imparting knowledge to newbies. |Organic gardening. |Lack of visability to the program due to no advertising. All word of mouth. 
197|Master Gardener Volunteer|0-5|Female|45-64|Brings together gardeners|not sure 🤔 |Try to get younger members somehow??|It’s difficult for people working full time with families to meet their requirements of maintaining the certification. I find it difficult to find volunteer opportunities on weekends that I have time for d/t household maintenance requirements. 
198|Master Gardener Volunteer|0-5|Female|25-44|Educational articles|? I just completed the MG training in fall so no issues right now |More environmental outings to help remove invasives|None
199|Master Gardener Volunteer|0-5|Female|65+|Initial training is excellent and there are valuable options for continuing education; program orients MGVs to a broad selection of volunteer options; leaders are approachable/engaging/dedicated and work to create a sense of community and camaraderie|Coordination and communication both within the program and with other gardening organizations is a challenge. Avoid trying to do too much. Focus is important. The flip side is to give MGVs sufficient freedom in their volunteering to pursue their own interests. |"Trends: the importance of gardens and gardening to health and welfare; the interest and development of new types of gardens (urban space, accessible gardens, sensory gardens), new ways of understanding how plants relate to each other (e.g. edibles mixed with flower beds, plants communities and ""green mulch"", ways to use biocontrols instead of heavy pesticide/herbicide use. The MGV program already stresses a more ""organic"" approach to gardening and can be a platform for sharing this expertise more widely."|"Obstacles: lack of understanding/awareness about the program's contributions; need to have the beneficiaries be vocal about the impact and importance of what is being accomplished. Not sure about ""competitors"". This goes back to the earlier comment about the importance of communication and coordination with other agencies/institutions to create synergy and leverage eahc others' resources and activities."
200|Master Gardener Volunteer|10+|Female|45-64|Talking to people and educating them on the world of plants.|I hate keeping track of hours.|We have to get the younger generation involved.|Government.
201|Master Gardener Volunteer|10+|Female|65+|Supports local community gardens and school gardens|Too much local emphasis on fund raising with over $20,000 with over in treasury   and not spending it. Eliminate the fund raising. My group has too many projects.  Eliminate bus trips because they are used to make money and more community take advantage than MGs. |Put a limit on amount held in groups treasury so it can be spent in the community projects. The training program does not end with many participants joining the MG .org. |There is a big garden club here that anyone can join without so many requirements. 
202|Master Gardener Volunteer|43595|Female|45-64|Educational curriculum, online publications (Learning Store), opportunity to share passion for gardening with other volunteers and the local community|Shift of focus away from volunteers towrards supporting UW mandates and policies. (A recent article trying to differentiate between the roles of UW system and the master gardener association left me a bit bewildered.  As a volunteer of nearly a decade, I prefer to keep my focus on our improving our OCMGA programs locally, outside the context of all the political turmoil at the state level.  AS a member of our Board, I find the decreasing fpcus on listening to volunteers as opposed to communicatingedicts from above disappointing.   [We lost some knowledgable, committed volunteers due to the various bacjground check requirements over the years, some of whom spent years trying to recover from stolen identities in th past-UW seemed to show alack of empathy and support for “volunteers” .)|The expanding interest in school gardening programs (WI seems to be behind many other states in embracing theae programs (beyond possibly the Madison area) offers an opportunity to educate a future generation empowering them to make more informed choices regarding locally grown vs heavily proceesed foods packaged in environmentally unfriendly ways.   Collaboration with other Wi groups to create educational materials available for use throughtthe state would be a great alternative to each county spending volunteer time and money creating their own.|Actually “how the program is run” in recent years does indeded create one of the bigger threats. I  see “competition” for volunteer time and energy coming from other organizations offering a better volunteer experience with more support and less time “wasted” dealing ith political posturing on a local and state level.  The attrition rate from the programin the first severalyears after training is too high with all the rsources invested in training volunteers. Mor focus might be made on imrpoving volunteer experiences as they transition from training.  I am persoanlly comitting time and energy to Wild Ones native landscaping, the local garden club and an herb group (as well as Habitat and other groups outside the gardning community) with my time  being focused where I feel the most personal satisfaction and opportunity to have an impact on issues of current priority.     All the focus on hours qnd how they are collected takes focus away from the impact of our programs vs the amount of time spent (or wasted soemtimes) on “santioned projects” and endless committee and Board meetings).  Asking for a summary of X number of programs each year telling us what the focus is as the summary is the year so efforts can be adjusted to focus on those issues opposed to 
203|County Coordinator/Educator|0-5|Female|25-44|The concept of creating a volunteer group to assist in public education of horticulture. |Streamline & control the process of having master gardener groups between counties. |Embrace the transition to Madison and revamping the entire program|The upcoming generations need for instant gratification, a lot of the programing is time and age based. Also the continual number of hours needed instead of just having 1 day events that the certification can be kept with,  
204|Master Gardener Volunteer|43595|Female|65+|Social networking and community involvement |Need more direct support from UWEX and help with publicity and education in the community|Perhaps the ability to be more involved in urban garden networks|Lack of concern or support from Madison.  I do not see the recent changes to the Madison reorganization as positive for the MGV program.  Now there are not enough agriculture positions to support the MGV program.
205|Master Gardener Volunteer|43595|Female|65+|Learning new gardening ideas and socializing with gardeners|I would increase socialization and minimize the virtual/electronic aspects.|More school programs would build our future.|local garden clubs-how about inviting local clubs on bus trips or to meetings?  Invite their members to present to our membership?
206|Master Gardener Volunteer|10+|Female|65+|Education of the public about horticultural issues including invasive species.|Emphasis on preparing MGV students (those taking the training course) to help them feel comfortable speaking to small or large groups so that education is second nature when they become interns and eventually certified members.  I think we need to avoid getting ourselves bogged down in maintenance projects that go on forever.|We have the knowledge to help preserve the planet's resources from home landscaping and making wise choices about plants, chemicals, etc.  all the way to community sized plans for land use resources.  I think more of the training similar to the Placemaking program need to be part of MGV training.|The threat of reduced or losing funding is always an issue for this program.  We need to continue to document the work we do to ensure our future existence.  Competitors are other programs also funded with tax dollars.  
