ID|Role|YearsExperience|Gender|Age|Strengths|Weaknesses|Opportunities|Threats
341|Master Gardener Volunteer|10+|Female|45-64|Good at providing basic to intermediate, well-established information. Good at providing a structure within which opportunites are communicated to volunteers who are interested. I remain, in part, because I'm still learning, and because I value the intent of the program and information sharing between various stakeholders. I think the on-line reporting will be awesome. |As little bureaucracy as possible. People aren't very interested in running or attending meetings. Hard to get people willing to do that part of things. Anything you can do to make introducing new people to the program smoother would be good--ways to connect interns to existing volunteers and projects.  I wish we had better access to new university research as it emerges.|Not sure.|Demographics. The number of current MGVs and the number of people accustomed to acquiring information through a person-to-person model are declining. It'll be harder to get new volunteers. The audience those volunteers are trying to reach will be more comfortable with indirect communications. I don't think there's anyone else out there who competes directly with providing science-based information, but I'm not sure the audience will care. Competitors will be/are anyone who can do a YouTube video, credentials or not.   
342|Master Gardener Volunteer|10+|Female|45-64|The learning |More advertising there are a lot of people that don’t know about us and what we do for the community |Need to focus on recruiting new people |Alway competition with land and water and 4 H 
343|Master Gardener Volunteer|0-5|Female|65+|I really enjoyed the wide range of topics covered during.the training. I continue to learn in my volunteer service as well (an opportunity that i might not have found without MGV).|Qould have liked to know my fellow classmates and what they are in to now. |Not sure|Not sure
344|Master Gardener Volunteer|0-5|Female|65+|"As a member of the Door County training committee I believe that the 13 week training course is well done.  The videos are excellent and the facilitator materials provided are extremely beneficial. It's exciting to watch the students grasp the concepts and the confidence to grow.  Door County just completed the 13 week course, all of the students passed with flying colors!  We created a course evaluation in order to determine the strengths and weaknesses of the course.  We received great feedback which will allow us to slightly ""tweak"" the course for next year.  Overall, the students were pleased with the length and structure of the course.  I have learned so much over the past two years, and realize how much more I have to learn.  The resources available to me are endless and I refer to them constantly.    "|"As a relatively new Master Gardener (class of 2018) I'm not sure I've identified weaknesses.  The only thing to ""improve"" upon is to ""don't mess with a good thing""  Meaning, do not eliminate the 13 week training course!  It works really well!"|ddds|dddd
345|Master Gardener Volunteer|0-5|Female|65+|I LIKE THE OPPORTUNITY TO LEARN MORE ABOUT GARDENING AND OUR ENVIROMENT|OT BEING FRIM PORTAGE AND NEW TO THE PROGRAM I SOMETIMES FEEL ON THE FRINGE  PERHAPS A BUDDY SYSTEM OR HELP WITH PROJECT LOCATIONS?|TEAM UP WITH SCHOOLS SCOUTING FFA AND OTHERS LIBRARES TO EXPAND GARDENING A WARENESS|CENTRAL LOCATION..COUNTIES..ARENT ALWAYS CONVERNIENT TO REACHING OUT
346|Master Gardener Volunteer|10+|Female|65+|continual  learning and topic updates. Sharing with others in my community|The master gardener training program needs improvement - so we can bring on new members|changes in climate|in our county extension does not have an agent who has time for the master gardeners
347|Master Gardener Volunteer|0-5|Male|45-64|The program brings many like-minded people together that have similar demographic backgrounds and creates opportunities to work together in various capacities.|The plants plus articles have never been about any plant I am interested in.|I see the program incorporating more organic methods and much more about soil biology and the roles that microorganisms play in the soil.|I see cuts to funding of UW system support staff as an indirect threat to the program. Independent Gardening clubs do not pose a threat to the program. 
348|Master Gardener Volunteer|43595|Female|45-64|Great network of knowledgeable gardeners willing to help each other.  There are some very cool community programs.  Access to UW Madison online education and resources is wonderful.|"There is a lot of administrivia in tracking hours and training.  I've noticed that at least with our group, a large number of hours for the group are from administrative tasks rather than project activities.  There is a lack of consistency in how things are done among the many ""chapters"" in the state.  Sometimes the guidance on the UW site is vague.  Role of WIMGA vs UW is very unclear."|I'd love to see aligned mission and vision among all the chapters, as well as recommended major projects, to help align and join together the many chapters.  Please get the hours and training tracking to be electronic and managed by UW - with the ability for chapters to get their groups' specific details.|"threat - lack of younger gardeners joining - lack of minorities.  Competitors are the ""social"" groups - garden clubs - primarily.  It's important to make the program mission clear and embraced, as I see our MG group headed more down the social arena, which is sad..."
349|Master Gardener Volunteer|0-5|Female|25-44|I am excited for the opportunity to serve my community|I live on the edge of my county - most of the projects already set up are a 45 minute drive away - I feel a little isolated. I have developed my own projects closer to home, but am still looking for more MG out here.|More involvement with food pantries, community gardens, possibly food preparation and preserving classes to teach folks how to use and save what they grow - combat food insecurities|funding cuts; busy schedules keeping people from taking the class or being able to volunteer; lack of clarity on education requirements and opportunities to fulfill the education requirements
350|Master Gardener Volunteer|0-5|Female|25-44|Community outreach and education, environmental stewardship|The county association to which I belong is majority white, female and 60+ years old.|Opportunities to strengthen existing volunteer projects and begin new, focused education-based projects.|Potential external obstacles/concerns may result from the merger, with certain project partners unwilling/unable to honor MOUs
351|Master Gardener Volunteer|10+|Male|65+|I t is a good training platform for candidates and quite good additional training.  Our chapter has great support help and educational opportunities|I would like to see more in depth second level courses in  plant disease recognition and insect identification.  I also would like to see expanded recognition (credit) for reading and studying text books and certain articles related to soils and other horticultural items.  |Green County has not had a new class for quite some time.  Coordinating and updating that platform to train more students might help.|Time constants for many people.  Finding or creating projects/opportunities for new graduates to fulfill their volunteer hours..
352|Master Gardener Volunteer|43595|Female|65+|Continuing opportunities for education in all areas of gardening.|more support for local programs|education delivered in a variety of formats - including in-person programming, not online|Legislators decreasing funding.
353|Master Gardener Volunteer|43595|Male|65+|The landscaping/maint. program in Feb. is great but has become a bit repetitious. I haven't missed but one Friday sense I became an MGV.|Can't really think of anything at this time.|No comment at this time.|No comment at this time.
354|Master Gardener Volunteer|43595|Female|65+|Answers horticultural inquiries.|Location of Plant Health Advisor service.|Programs for schools to educate future MGs.|Funding.
355|Master Gardener Volunteer|0-5|Female|65+|Great places to garden. Interesting classes to attend|Too many irrelevant emails. Newsletter |I don't know |No clew
356|Master Gardener Volunteer|0-5|Male|65+|speaker programs, educational booths at various shows and fairs.|volunteering at local gardens does involve a great deal of volunteer time. I just question the impact on our communities, given how small and isolated some are.|We should be more involved, with advocacy for beautifying parks and public spaces.|Unfortunately there are no competitors. Sites will be planted with large evergreens and mowed.
357|Master Gardener Volunteer|0-5|Female|45-64|Education, giving back to the community, comradarie with other gardeners|Number of meetings, although communication is important|Who knows how technology will evolve|"Based on the need for volunteers, time and turn-over are obstacles - I know of no ""threats"""
358|Master Gardener Volunteer|10+|Female|65+|Dealing with adult public.|We need more diversity to be an urban program.|Urban gardening. Community gardens.|I avoid words such as threats.
359|Master Gardener Volunteer|10+|Female|45-64|I love all the knowledge--what others know as well as all that you share with us to further educate us.|I have recently moved from the Washington County group to the SE WI group, and I am seeing a GREAT amount of inconsistencies.|I would like to see more general sharing of the talents of the Master Gardener volunteers.  This can be done through general/chance meetings such as farmers markets, general presence at various events like the home show or garden club meetings.|I think your inconsistencies could be your undoing.  A person in one county has many more resources than other counties.  This can be an issue to the MGVs as well as to our clients.  Not sure who our competitors are since my experiences in the different counties is so drastically different.
360|Master Gardener Volunteer|0-5|Female|45-64|Online Continuing Education|Some counties don't have strong groups|Collaborate with local government to enhance green space in small communities|Lack of funding
361|Master Gardener Volunteer|0-5|Female|65+|The opportunities (seems endless!) to continue self learning, whether they be online, in print, in classes or volunteer sites.|Sometimes written communication is a little confusing as to what is actually trying to be conveyed/said.|I think continuing to encourage the development of new garden locations, small or large, is something that should be continued.  These educational opportunities with garden development and sustainance will reap benefits for generations.  I think nutrition education along with gardening is a great idea as well.|Certainly lawn services and garden centers are competitors, but partnering with these places could produce new educational opportunities for the public.
362|Master Gardener Volunteer|0-5|Female|45-64|Continuing learning opportunities|Offer more initial training sessions for those who want to become master gardener volunteers|Embracing technology|Lack of time is always an issue! Competitors include friend and family commitments, along with hours spent at our regular jobs.
363|Master Gardener Volunteer|43595|Female|65+|Educates well. I look forward to information about all the new plant varieties.|nothing|more involvement with the native plant movement|budgets cuts. garden centers are offering more and more classes
364|Master Gardener Volunteer|10+|Female|65+|Educational programs and Botanical Garden events|Same old programs - new strategic plan and new blood- younger and energetic volunteers |Engage UW Hort students and graduates in presentations, organizing and running programs for school credit. |Aging volunteers who are less flexible to do the heavy lifting or who are too particular in what they care  to do. 
365|Master Gardener Volunteer|0-5|Female|25-44|Established history of program, knowledgeable MGs, switch to online learning |Older volunteers stuck in rut of only their projects with no real education to public, manpower issues for projects, poor or inconsistent online presence across counties|Do more with online publicity, do more public education (classes, seminars, etc) More interaction with school, scout, library, after school groups|Not seen as service group so younger people don’t join
366|Master Gardener Volunteer|0-5|Female|45-64|Community service|Disorganized and inconsistent|Growing healthy food for the communities in need.|Lack of resources to contact members and frankly the aging of members.  Most will be unable to help or dead and young  members are not joining.
367|Master Gardener Volunteer|43595|Female|45-64|Community outreach|diversity of people |community outreach|none
368|Master Gardener Volunteer|0-5|Female|65+|Great education opportunities for home gardeners|Extend education opportunities locally during fall and winter months|More education digitally|I don’t know
369|Master Gardener Volunteer|0-5|Prefer not to respond|45-64|Using our skills to better the group|Lack of central cohesive goal/basic organizational procedures, too many projects, not well rounded projects|Suggest programs require at least one project in each of the 4 MG bucket areas|Social garden clubs.  Other volunteer groups/service leagues attracting potential members
370|Master Gardener Volunteer|0-5|Female|65+|Educating the community on beauty and creativity in all aspects of gardening|Haven't found any|Incorporating diversity within its membership|if younger people lack the desire to become involved
371|Master Gardener Volunteer|0-5|Female|18-24|Requiring volunteer hours! |The website is not super user friendly, especially in terms of continuing education and finding local volunteer locations.|The program could provide table to recruit more young people! A junior master gardener program with less requirements could also recruit much younger children at an early age. I live in Ashland, and i struggle going to many Master Gardener events because there is nobody close to my age present (22).|Definitely a lack of diverse ages for me. I know of enough locations to volunteer, but finding continuing education programs that are not in the middle of a work/school day is hard. 
372|Master Gardener Volunteer|10+|Female|45-64|speakers at meetings|less paperwork|trial gardens for local/regional favorites|lack of time
373|Master Gardener Volunteer|0-5|Female|65+|Heirloom plant sale|Some meetings unnecessary; info could be emailed |Hands on community workshops- container gardening|None
374|Master Gardener Volunteer|0-5|Female|25-44|Getting into the community and using gardening as a community builder and educational experience|Keep in mind that some people work full-time jobs and to keep volunteer and continuing educational opportunities at times when such people can attend|This question would be more helpful if the program goals were listed ... I honestly don't know what current trends exist to know what could be embraced.|"Amount of time people actually have to volunteer, a general ""aging"" of the program if people working full time cannot participate (as this groups tends to be younger), local community gardening groups that are closer to home could be a competitor"
375|Master Gardener Volunteer|0-5|Male|45-64|tons of educational opportunities!|sadly, the volunteer hours are a real challenge for those who are still employed full-time|more education outreach opportunities, increasing awareness of nature, invasives, landscaping, etc.|growing the program, more MGVs, is a challenge
376|Master Gardener Volunteer|0-5|Female|65+|Provides actual factual information. |Continues to promote big-ag solutions, and ignore valid studies that don’t have corporate support. |It is difficult to get volunteer hours because there is no training about how to build the client-based programming that is the goal. |Our competitors speak loudly with beautiful graphics and lack of scientific foundation.  The biggest need is finding convincing ways to promote research-based information amid all the competing clamor. 
377|Master Gardener Volunteer|43595|Female|65+|What the program does well:  evidenced based practice, multiple opportunities for continuing ed, tapping into the expertise, talent and interests of the volunteer group, allowing/fostering creative independence in the approved gardens|Improve use of technology - for example, provide reliable audio/visual at large group educational sessions, increase webinars, record evidence based sessions for viewing by those unable to attend.   If significant changes are coming, keep in touch frequently and explain clearly.  I’m hearing that volunteers are concerned that the future MGV requirements will be more than they can or want to do.  Don’t lose sight of the contributions of those who only want to bring the beauty of gardens to their communities |How about reaching out to future generations with a ‘junior’ gardener volunteer program?|Urban/suburban development 
378|Master Gardener Volunteer|43595|Female|45-64|The Milwaukee CO MG group is very active and offers many opportunities to educate ourselves and then the community.  |If we can afford it pay for a booth at the Home and Garden Show.  I volunteered there 2x this year and we don't get nearly the foot traffic we could if in a better location.|We need to attract more people under 50! Offer the training in the evening.|We are an aging demographic, we need to attract younger volunteers.
379|Master Gardener Volunteer|0-5|Female|65+|Service to the community via horticulture related activities; social benefits|There are projects that require a great deal of commitment so it takes special people to step up to the plate|much depends on how much time people are willing to commit to opportunities|overworked educators
380|Master Gardener Volunteer|0-5|Female|45-64|Constant education on gardening|We are asked to be teachers and teach the public.  This is being pushed on us for the last 3 years. I didnt sign up to the master gardeners to be a teacher, i signed up to be a gardener.  If teaching is constantly pushed on us, I will  most likely quit. |No comment|Pushing us to be teachers. 
381|Master Gardener Volunteer|0-5|Female|65+|Exucation and information. Amazing people to meet and know. Important and fun projects| Sometimes I wonder if some of the modules are too technical not everybody needs to know all the scientific names for everything. I like the garden clinic. I like all of the educational speakers and events. I like to come Ratterree I like feeling our work matters based in research |Placemaking, green spaces, community cohesiveness around plants and places of beauty and import|Energy! Maybe only money time and people. I don’t know who our competitors are other community and neighborhood groups maybe
382|Master Gardener Volunteer|43595|Female|45-64|Fellowship with fellow gardeners.|More educational opportunities.|Promote home vegetable gardening.  HOA’s that prohibit backyard gardens need to be overturned.|Many people don’t know about the Master Gardener program.
383|Master Gardener Volunteer|0-5|Prefer not to respond|45-64|Getting out into the community as a volunteer and interacting with others on aspects of gardening,|Better coordinated volunteer opportunities to get my volunteer hours needed to maintain MG status.|Not just seeking out opportunities in the communities....but creating and orchestrating them!!|"I havent been involved long enough to find ""competitors""?? There is a great communication in my community between the few gardening groups and cooperation/collaboration."
384|Master Gardener Volunteer|0-5|Female|45-64|The many opportunities to be involved in gardening in my community |Offer more continuous education in my community |There are so many opportunities to educate and plan future garden projects|Not having a strong leader such as Vijay 
385|Master Gardener Volunteer|43595|Female|65+|Excellent reputation , great online resources, provides opportunity to network and socialize|There's such inconsistency in Level 1 training across the state-  should be more standardized|We need to vigorously support the local food movement and extend the grade school gardens into high school|"It's hard to engage the younger generation-  they participate in activities but don't see the need to ""belong"" or commit to an organization"
386|Master Gardener Volunteer|43595|Female|65+|Education from UW staff in our geographic area--Huddleston, Phil Pelletier, & local UW staff ie Whitaker|Don't like online courses--due to limited Internet band, connection, cost|Prefer volunteer opportunities that encourage one to one contacts with flexibility versus having to do education to groups or young people.  Need to offer flexibility to take Volunteer strengths and let them use in situations that they're comfortable in.|Budgeting; changes in local UW campus support (now UW-Stevens Pt-Wausau); competition for local funding grants from other groups
387|Master Gardener Volunteer|0-5|Female|65+|Our projects enrich our community. They add to the beauty, improvement of habitat for wildlife, birds and insects, education of public including children, about these things and healthier diets, and the interes and fun of gardening . Some of my favorite projects have been helping create native flower gardens in Green Bay and DePere for Monarchs, other butterflies and pollinators.|Can't think of any|a|s
388|Master Gardener Volunteer|10+|Female|45-64|Strengths:  MG certification levels 1&2, ongoing educational programming.  Excites me:  plant sale, garden walk, garden conference|Eliminate:  counting hours for MG's weeding gardens like cemeteries, churches and businesses as certified projects and hours.  |Trends to embrace:  more on-line education opportunities cor hours.  |Obstacles: rampant staff loss and change over in the last 4 years
389|Master Gardener Volunteer|10+|Female|45-64|Love the garden walk each year.|Too much paperwork |Educate and encourage the public|Too many rules and regulations are a threat to membership 
390|Master Gardener Volunteer|43595|Female|65+|education|we need improvement in our communication beteween the agent and the volunteers|The possiblilties in our demonstration gardens are limitless if only we could persue our goals in a timely manner.  As the president, I heard many complaints that things that we plan just do not get off of the ground.|The garden shops are growing in popularity and are getting information  out on the media for interesting topics for the backyard gardener
391|Master Gardener Volunteer|10+|Female|65+|Brings like minded and like enthusiastic people together. Makes enthusiastic gardeners credible educators due to University based training and continuing ed.. |"I would like to see the program reach out to high school age students (especially schools with a greenhouse.) The organization needs capture a younger demographic to continue the program for years ahead.  A computer based general certification should already be available ...working parents, high school age students, retired folk that no longer drive at night...start thinking outside the current box.  This program should have a year deadline for finishing the training and taking the test. ( or 2 semesters)...so many WI schools have thriving Ag programs...tap into those programs.  I would also like the ""rules"" to include those older MGV's that have had perhaps a season of medical issues, or a family member needing assist with medical issues time to gather the required volunteer hours and ed hours.  Currently, if you are short hours ...no exceptions....you are penalized in some form.  The attitude is sorry, don't need you!!! The SEW group heading the committees is very tight...I fee very uncomfortable around them...the attitude is my way or the highway.  I have never felt welcome at the meetings."|The trend is something we are all aware of...no secret...online everything...including education at all technical schools in the state as well as colleges and universities...when is the MG program going to catch up???|We are all aging out!!!! No MG programs without the volunteers...recruit, recruit, recruit.......
392|Master Gardener Volunteer|10+|Female|65+|Education and providing materials regarding current gardening problems|Increase visibility outside UW Madison’s sphere of influence |Try to interest youth in gardening|Web searches but not all information out there  is accurate
393|Master Gardener Volunteer|43595|Female|65+|The program educates its members very well through speakers, on line reading material, field days. The program connects like minded gardeners, forming friendships that might not otherwise happen. |"Its getting too complicated especially the hours recording process.  We do gardening activities for relaxation, now there is a layer of approved projects, which ""bucket"" they fall in. etc etc."|"none going down the path we are headed.  Already members are saying ""its too complicated"", too nit-picking. I sense MGVs are being used to create a UW job for several people."|The disappearence of the UW extension being absorbed by the University
394|Master Gardener Volunteer|43595|Female|65+|Educates the public about gardening|Need more young Master Gardeners and also people of color in the organization|Climate change education|Cuts to funding; older members not being replaced by young people
395|Master Gardener Volunteer|0-5|Female|45-64|Such a great resource for gedening information|all the nitpicking|Not sure|Busy lives - it's tough to fit in the hours required.  Especially when the location of projects is often a distance. 
